{
  "$schema": "https://json-schema.org/draft/2020-12/schema",
  "$id": "https://sdar.io/schemas/provider-ops-envelope-1.1.0.json",
  "title": "SMPP ProviderOpsEnvelope 1.1.0",
  "type": "object",
  "required": [
    "schemaName",
    "schemaVersion",
    "recordId",
    "recordHash",
    "recordType",
    "eventCategory",
    "deliveryClass",
    "providerId",
    "runtimeVersion",
    "instanceId",
    "occurredAt",
    "emittedAt",
    "attributes",
    "payload"
  ],
  "properties": {
    "schemaName": {
      "const": "sdar.provider.ops.event"
    },
    "schemaVersion": {
      "const": "1.1.0"
    },
    "recordId": {
      "type": "string",
      "format": "uuid"
    },
    "recordHash": {
      "type": "string",
      "pattern": "^[a-f0-9]{64}$"
    },
    "recordType": {
      "type": "string",
      "enum": [
        "provider.task.lifecycle",
        "provider.command.lifecycle",
        "provider.scheduler.decision",
        "provider.recovery.lifecycle",
        "provider.ttl.lifecycle",
        "provider.resource.state",
        "provider.resource.metric",
        "provider.resource.health",
        "provider.execution.progress",
        "provider.business_event.source.lifecycle",
        "provider.business_event.ingest.lifecycle",
        "provider.business_event.publication.lifecycle",
        "provider.business_event.stream.lifecycle",
        "provider.business_event.continuity",
        "provider.business_event.delivery.lifecycle",
        "provider.business_event.relation.lifecycle"
      ]
    },
    "eventCategory": {
      "type": "string",
      "enum": [
        "task.lifecycle",
        "command.lifecycle",
        "command.dispatch",
        "scheduler.decision",
        "recovery.lifecycle",
        "ttl.lifecycle",
        "resource.state",
        "resource.metric",
        "resource.health",
        "execution.progress",
        "business_event.lifecycle"
      ]
    },
    "deliveryClass": {
      "type": "string",
      "enum": [
        "audit",
        "operational"
      ]
    },
    "providerId": {
      "type": "string",
      "minLength": 1,
      "maxLength": 256
    },
    "runtimeVersion": {
      "type": "string",
      "minLength": 1,
      "maxLength": 64
    },
    "instanceId": {
      "type": "string",
      "minLength": 1,
      "maxLength": 256
    },
    "taskId": {
      "type": "string",
      "maxLength": 256
    },
    "resourceId": {
      "type": "string",
      "maxLength": 512
    },
    "resourceType": {
      "type": "string",
      "maxLength": 128
    },
    "externalExecutionId": {
      "type": "string",
      "maxLength": 256
    },
    "operationName": {
      "type": "string",
      "maxLength": 256
    },
    "correlationId": {
      "type": "string",
      "maxLength": 256
    },
    "traceId": {
      "type": "string",
      "pattern": "^[a-f0-9]{32}$"
    },
    "spanId": {
      "type": "string",
      "pattern": "^[a-f0-9]{16}$"
    },
    "providerEventId": {
      "type": "string",
      "maxLength": 256
    },
    "providerEventSequence": {
      "type": "integer",
      "minimum": 0
    },
    "eventType": {
      "type": "string",
      "maxLength": 128
    },
    "executionMode": {
      "type": "string",
      "maxLength": 64
    },
    "simulationId": {
      "type": "string",
      "maxLength": 256
    },
    "argumentHash": {
      "type": "string",
      "maxLength": 128
    },
    "authorizationContextHash": {
      "type": "string",
      "maxLength": 128
    },
    "adapterRevision": {
      "type": "string",
      "maxLength": 128
    },
    "observationRevision": {
      "type": "integer",
      "minimum": 0
    },
    "commandSequence": {
      "type": "integer",
      "minimum": 0
    },
    "occurredAt": {
      "type": "string",
      "format": "date-time"
    },
    "emittedAt": {
      "type": "string",
      "format": "date-time"
    },
    "attributes": {
      "type": "object",
      "properties": {
        "correlation": {
          "type": "object",
          "properties": {
            "originSystem": { "type": "string", "minLength": 1, "maxLength": 64 },
            "originDeploymentId": { "type": "string", "minLength": 1, "maxLength": 256 },
            "originRuntimeInstanceIds": { "type": "array", "maxItems": 64, "items": { "type": "string", "minLength": 1, "maxLength": 256 } },
            "originTaskIds": { "type": "array", "maxItems": 64, "items": { "type": "string", "minLength": 1, "maxLength": 256 } },
            "originInvocationIds": { "type": "array", "maxItems": 64, "items": { "type": "string", "minLength": 1, "maxLength": 256 } }
          },
          "additionalProperties": true
        }
      },
      "additionalProperties": true
    },
    "payload": {}
  },
  "additionalProperties": true
}
