[{"payload": {"event": "received", "sourceId": "vehicle.health", "inboxState": "received", "decodeStatus": "decoded", "sourceEventId": "wXk47tI6mT0ywBcW6YhJngt9Ki3xUJJBBeZjHFZya4c", "sourceSequence": "11", "sourceStreamId": "018f0d4e-7b3a-7cc1-8d57-2f4d9e2a1002", "rawEnvelopeHash": "sha256:229efe45902dccec3f5799dc04e4a6dce037502a7faaa0b313b23c0e82520578"}, "recordId": "23c6c018-cb69-54e1-a846-6c8a1087ba6a", "emittedAt": "2026-09-07T05:36:27.660Z", "attributes": {}, "instanceId": "e1-runtime-20260907", "occurredAt": "2026-09-07T05:26:11.495Z", "providerId": "isr.vehicle.ugv.ugv1", "recordHash": "2100d95090175ce6ac3152d7bbd4cd92acdcd9db0157da4504487fff6f67bd38", "recordType": "provider.business_event.ingest.lifecycle", "schemaName": "sdar.provider.ops.event", "deliveryClass": "audit", "eventCategory": "business_event.lifecycle", "schemaVersion": "1.1.0", "runtimeVersion": "2.0.0-rc.1"}, {"payload": {"event": "published", "scope": "resource", "eventId": "-vhyNoRlc5iEl1-tRMDCmmrSeiMEy79-a1SQuBcJaE8", "outcome": "published", "sourceId": "vehicle.health", "streamId": "c64cf0b9-cef8-43db-bac0-d015e05121a0", "sourceSequence": "11", "runtimeSequence": "6"}, "recordId": "ae882d77-a2b4-536c-bc22-27dc417e995f", "emittedAt": "2026-09-07T05:36:27.729Z", "attributes": {}, "instanceId": "e1-runtime-20260907", "occurredAt": "2026-09-07T05:26:11.495Z", "providerId": "isr.vehicle.ugv.ugv1", "recordHash": "17180bb54ff9e1100913141bfb53597b976a6fe552a3e8069fc0de095b52f01b", "recordType": "provider.business_event.publication.lifecycle", "schemaName": "sdar.provider.ops.event", "deliveryClass": "audit", "eventCategory": "business_event.lifecycle", "schemaVersion": "1.1.0", "runtimeVersion": "2.0.0-rc.1"}]
